{
  "plate_number": "123ABC02",
  "direction": "ENTRY",
  "event_time": "2026-06-13T10:15:32+05:00",
  "confidence": 0.94,
  "camera_name": "Entry_Camera",
  "source": "hikvision-anpr",
  "photos": {
    "plate": "http://minio:9000/parking/123ABC02/ab12_plate.jpg",
    "vehicle": "http://minio:9000/parking/123ABC02/ab12_vehicle.jpg"
  },
  "raw_ref": "captures/2026-06-13T10-15-32/event.xml"
}
